{
  "id": "evt_001",
  "org_id": "org_11111111-1111-1111-1111-111111111111",
  "timestamp": "2025-10-30T22:30:00Z",
  "actor_id": "usr_pm_001",
  "actor_role": "pm",
  "action": "status_changed",
  "entity_type": "project",
  "entity_id": "123e4567-e89b-12d3-a456-426614174000",
  "project_id": "123e4567-e89b-12d3-a456-426614174000",
  "changes": {
    "before": {
      "status": "bidding"
    },
    "after": {
      "status": "active"
    }
  },
  "metadata": {
    "ip_address": "192.168.1.100",
    "user_agent": "Mozilla/5.0 (Macintosh; Intel Mac OS X 10_15_7)",
    "trace_id": "trace_abc123",
    "session_id": "session_xyz789"
  },
  "pii_redacted": false
}